Title,Authors,Date,Abstract,Keywords
Assessment of circulating tumor DNA in patients with locally advanced rectal cancer treated with neoadjuvant therapy,"Chiara Molinari, Giorgia Marisi, George Laliotis, Erik Spickard, Ilario Giovanni Rapposelli, Elisabetta Petracci, Giby V. George, Punashi Dutta, Shruti Sharma, Meenakshi Malhotra, Andrea Prochowski Iamurri, Giacomo Feliciani, Minetta C. Liu, Paola Ulivi, Matteo Canale, Luca Saragoni, Graziana Gallo, Giovanni Luca Frassineti, Margherita Muratore, Antonino Romeo, Adham Jurdi, Giovanni Martinelli, Alessandro Passardi",2024-11-28,"Post-neoadjuvant therapy (post-NAT) and post-surgical circulating tumor DNA (ctDNA) risk stratification may enhance the management of patients with locally advanced rectal cancer (LARC). In this study, we assessed the prognostic value of ctDNA-based MRD detection in LARC patients using a personalized, tumor-informed ctDNA assay. Plasma samples from LARC patients (N = 30) were analyzed retrospectively using the Signatera™ assay. The neoadjuvant rectal (NAR) score was calculated and compared to ctDNA status to predict recurrence risk and survival outcomes. ctDNA-positive patients post-NAT and post-surgery had worse Disease Free Survival (DFS) (HR: 7.82; p = 0.001, HR: 19.65; p = 0.001) when compared to ctDNA-negative patients. In the post-NAT setting, patients who responded to NAT had superior DFS compared to patients who did not clear their ctDNA or showed no radiological response (HR: 24.7, p = 0.001 and HR: 5.1, p = 0.054, respectively). When ctDNA status is used alongside the NAR score in the post-NAT setting, patients who were ctDNA-positive with an intermediate or high NAR score showed significantly worse DFS (HR: 47.5, p < 0.001) compared to ctDNA-negative patients with either a low or intermediate/high NAR score (HR: 9.8, p = 0.0301). Post-NAT ctDNA status, whether used alone or in combination with the NAR score, may predict NAT response, and improve risk stratification.","Circulating tumor DNA, Locally advanced rectal cancer, Biomarker, Neoadjuvant therapy, NAR score"
Whole-exome sequencing reveals genomic landscape of intrahepatic cholangiocarcinoma and identifies SAV1 as a potential driver,"Zheng-Jun Zhou, Yu-Hang Ye, Zhi-Qiang Hu, Yue-Ru Hou, Kai-Xuan Liu, Rong-Qi Sun, Peng-Cheng Wang, Chu-Bin Luo, Jia Li, Ji-Xue Zou, Jian Zhou, Jia Fan, Cheng-Li Song, Shao-Lai Zhou",2024-11-17,"Intrahepatic cholangiocarcinoma (ICC) is the second most common primary hepatic malignancy after hepatocellular carcinoma, with poor prognosis and limited treatment options. The genomic features of ICC in Chinese patients remain largely unknown. In this study, we perform deep whole-exome sequencing of 204 Chinese primary ICCs and characterize genomic alterations and clonal evolution, and reveal their associations with patient outcomes. We identify six mutational signatures, including Signatures A and F, which are highly similar to previously described signatures linked to aristolochic acid and aflatoxin exposures, respectively. We also identify 13 significantly mutated genes in the ICC samples, including SAV1. We find that SAV1 was mutated in 2.9% (20/672) of 672 ICC samples. SAV1 mutation is associated with lower SAV1 protein levels, higher rates of tumor recurrence, and shorter overall patient survival. Biofunctional investigations reveal a tumor-suppressor role of SAV1: its inactivation suppresses Hippo signaling, leading to YAP activation, thereby promoting tumor growth and metastasis. Collectively, our results delineate the genomic landscape of Chinese ICCs and identify SAV1 as a potential driver of ICC.",
Generation of chimeric antigen receptor T cells targeting p95HER2 in solid tumors,"Macarena Román Alonso, Ariadna Grinyó-Escuer, Santiago Duro-Sánchez, Irene Rius-Ruiz, Marta Bort-Brusca, Marta Escorihuela, Susana Maqueda-Marcos, Sandra Pérez-Ramos, Judit Gago, Vanesa Nogales, Martín Espinosa-Bravo, Vicente Peg, Santiago Escrivá-de-Romaní, Laia Foradada, Laura Soucek, Irene Braña, Vladimir Galvao, Silvia Martín-Lluesma, Ekkehard Moessner, Christian Klein, Elena Garralda, Cristina Saura, Joaquín Arribas",2024-11-18,"The redirection of T lymphocytes against tumor-associated or tumor-specific antigens, using bispecific antibodies or chimeric antigen receptors (CAR), has shown therapeutic success against certain hematological malignancies. However, this strategy has not been effective against solid tumors. Here, we describe the development of CAR T cells targeting p95HER2, a tumor-specific antigen found in HER2-amplified solid tumors. These CAR T cells display robust activity against p95HER2-expressing cell lines but demonstrate limited efficacy against patient-derived xenografts. As p95HER2 is invariably detectable on tumor cells that overexpress HER2, but not those that express HER2 at normal levels, we arm p95HER2-specific CAR T cells with affinity-tuned bispecific antibodies against HER2 and CD3 in order to redirect them only to HER2-amplified cells. The combination of p95HER2.CAR T cells and HER2 x CD3 bispecific antibodies lead to a complete regression in three HER2-positive, patient-derived mouse xenografts tumor models. This combination represents a promising strategy to redirect T cells against a subset of HER2-positive tumors.",
Uveal melanoma,,2020-04-09,No Abstract,
Dynamic FDG PET/CT for differentiating focal pelvic uptake in patients with gynecological cancer,"Sachimi Yamada, Tomoya Kotani, Nagara Tamaki, Yoshitomo Nakai, Yasuchiyo Toyama, Motoki Nishimura, Yasunori Nakamura, Takeshi Nii, Kei Yamada",2024-11-27,"This study aimed to evaluate the ability of serial whole-body dynamic PET/CT to differentiate physiological from abnormal 18F-FDG uptake in the abdomen and pelvis of gynecological cancer patients. We conducted a retrospective study of 61 18F-FDG PET/CT examinations for suspected gynecological malignancies or metastases between March 2018 and January 2020. Our protocol included four-phase dynamic whole-body scans. High-uptake foci with SUVmax > 2.5 in the abdominopelvic region caudal to the renal portal were picked up and visually evaluated as “changed” (disappeared during any phase or morphological changes in more than half of the foci) or “unchanged” in motion on the serial dynamic images. Focal 18F-FDG uptake was observed in 84 foci. Of the 58 foci determined pathologically or clinically to have pathological uptake, no change was observed on serial dynamic imaging in 54 foci (sensitivity, 93%). Of the 26 foci of physiological uptake, temporal changes in uptake were observed in 20 foci using dynamic imaging (specificity, 77%). The positive and negative predictive values were 90% and 83%, respectively, with an accuracy of 88%. Dynamic whole-body 18F-FDG PET/CT imaging allows for differentiation between pathological and physiological uptake in the abdominopelvic region of patients with gynecological cancer.","Whole-body PET/CT, 18F-FDG, Dynamic acquisition, Gynecological cancer, Physiological uptake"
Intrinsic temperature increase drives lipid metabolism towards ferroptosis evasion and chemotherapy resistance in pancreatic cancer,"Vincent de Laat, Halit Topal, Xander Spotbeen, Ali Talebi, Jonas Dehairs, Jakub Idkowiak, Frank Vanderhoydonc, Tessa Ostyn, Peihua Zhao, Maarten Jacquemyn, Michele Wölk, Anna Sablina, Koen Augustyns, Tom Vanden Berghe, Tania Roskams, Dirk Daelemans, Maria Fedorova, Baki Topal, Johannes V. Swinnen",2024-10-02,"A spontaneously occurring temperature increase in solid tumors has been reported sporadically, but is largely overlooked in terms of cancer biology. Here we show that temperature is increased in tumors of patients with pancreatic ductal adenocarcinoma (PDAC) and explore how this could affect therapy response. By mimicking this observation in PDAC cell lines, we demonstrate that through adaptive changes in lipid metabolism, the temperature increase found in human PDAC confers protection to lipid peroxidation and contributes to gemcitabine resistance. Consistent with the recently uncovered role of p38 MAPK in ferroptotic cell death, we find that the reduction in lipid peroxidation potential following adaptation to tumoral temperature allows for p38 MAPK inhibition, conferring chemoresistance. As an increase in tumoral temperature is observed in several other tumor types, our findings warrant taking tumoral temperature into account in subsequent studies related to ferroptosis and therapy resistance. More broadly, our findings indicate that tumoral temperature affects cancer biology.",
Medulloblastoma,,2019-02-14,No Abstract,
Rhabdomyosarcoma,,2019-01-07,No Abstract,
ISB 2001 trispecific T cell engager shows strong tumor cytotoxicity and overcomes immune escape mechanisms of multiple myeloma cells,"Laura Carretero-Iglesia, Olivia J. Hall, Jérémy Berret, Daniela Pais, Carole Estoppey, Myriam Chimen, Thierry Monney, Jeremy Loyau, Cyrille Dreyfus, Julie Macoin, Cynthia Perez, Vinu Menon, Isabelle Gruber, Amélie Laurendon, Lydia N. Caro, Girish S. Gudi, Tomomi Matsuura, Piet H. van der Graaf, Stanislas Blein, M. Lamine Mbow, Rebecca Croasdale-Wood, Ankita Srivastava, Michael R. Dyson, Thomas Matthes, Zeynep Kaya, Claire M. Edwards, James R. Edwards, Sophie Maiga, Catherine Pellat-Deceunynck, Cyrille Touzeau, Philippe Moreau, Cyril Konto, Adam Drake, Eugene A. Zhukovsky, Mario Perro, Maria Pihlgren",2024-09-11,"Despite recent advances in immunotherapies targeting single tumor-associated antigens, patients with multiple myeloma eventually relapse. ISB 2001 is a CD3+ T cell engager (TCE) co-targeting BCMA and CD38 designed to improve cytotoxicity against multiple myeloma. Targeting of two tumor-associated antigens by a single TCE resulted in superior cytotoxic potency across a variable range of BCMA and CD38 tumor expression profiles mimicking natural tumor heterogeneity, improved resistance to competing soluble factors and exhibited superior cytotoxic potency on patient-derived samples and in mouse models. Despite the broad expression of CD38 across human tissues, ISB 2001 demonstrated a reduced T cell activation profile in the absence of tumor cells when compared to TCEs targeting CD38 only. To determine an optimal first-in-human dose for the ongoing clinical trial (NCT05862012), we developed an innovative quantitative systems pharmacology model leveraging preclinical data, using a minimum pharmacologically active dose approach, therefore reducing patient exposure to subefficacious doses of therapies.",
Sintilimab in combination with stereotactic body radiotherapy and granulocyte-macrophage colony-stimulating factor in metastatic non-small cell lung cancer: The multicenter SWORD phase 2 trial,"Jianjiao Ni, Xiaofei Wang, Lin Wu, Xinghao Ai, Qian Chu, Chengbo Han, Xiaorong Dong, Yue Zhou, Yechun Pang, Zhengfei Zhu",2024-08-22,"This single-arm, multicenter, phase 2 trial (NCT04106180) investigated the triple combination of sintilimab (anti-PD1 antibody), stereotactic body radiotherapy (SBRT) and granulocyte-macrophage colony-stimulating factor (GM-CSF) in metastatic non-small cell lung cancer (NSCLC). With a median follow-up of 32.1 months, 18 (36.7%, 90% CI 25.3%–49.5%) of the 49 evaluable patients had an objective response, meeting the primary endpoint. Secondary endpoints included out-of-field (abscopal) response rate (ASR), progression-free survival (PFS), overall survival (OS), and treatment-related adverse events (TRAEs). The ASR was 30.6% (95% CI 18.3%–45.4%). The median PFS and OS were 5.9 (95% CI 2.5–9.3) and 18.4 (95% CI 9.7–27.1) months, respectively. Any grade and grade 3 TRAEs occurred in 44 (86.3%) and 6 (11.8%) patients, without grade 4–5 TRAEs. Moreover, in pre-specified biomarker analyses, SBRT-induced increase of follicular helper T cells (Tfh) in unirradiated tumor lesions and patient’s blood, as well as of circulating IL-21 levels, was found associated with improved prognosis. Taken together, the triple combination therapy was well tolerated with promising efficacy and Tfh may play a critical role in SBRT-triggered anti-tumor immunity in metastatic NSCLC.",
Immunotherapy that improves response to chemotherapy in high-grade serous ovarian cancer,"Samar Elorbany, Chiara Berlato, Larissa S. Carnevalli, Eleni Maniati, Simon T. Barry, Jun Wang, Ranjit Manchanda, Julia Kzhyshkowska, Frances Balkwill",2024-11-22,"Single-cell RNA sequencing (scRNAseq) of tumour-infiltrating immune cells in high-grade serous ovarian cancer (HGSOC) omental biopsies reveals potential targets that could enhance response to neo-adjuvant chemotherapy (NACT). Analysis of 64,097 cells identifies NACT-induced overexpression of stabilin-1 (clever-1) on macrophages and FOXP3 in Tregs that is confirmed at the protein level. STAB1 inhibition in vitro induces anti-tumour macrophages. FOXP3 anti-sense oligonucleotide (FOXP3-ASO), repolarises Tregs to an effector T cell phenotype. ScRNAseq on 69,781 cells from an HGSOC syngeneic mouse model recapitulates the patients’ data. Combining chemotherapy with anti-stabilin1 antibody and/or Foxp3-ASO significantly increases survival of mice with established peritoneal disease in two HGSOC syngeneic models and progression-free survival in a third model. Long-term survivors (300 days + ) are resistant to tumour rechallenge. Anti-stabilin1 antibody enriches the tumours with CXCL9+ macrophages and Foxp3-ASO increases TBET cell infiltration. Our results suggest that targeting these molecules in immune cells may improve chemotherapy response in patients.",
FBP1 over-expression suppresses HIF-1α in papillary thyroid cancer,"Huashui Li, Wenjun Xie, Xiangqin Huang, Yifan Chen",2024-11-25,"Papillary thyroid carcinoma (PTC) is generally a slow-growing disease with a favorable 10-year survival rate. However, about 10% of PTC cases show significant aggressiveness, with tendencies for local invasion or distant metastasis, the mechanisms of which remain unclear. This study aims to identify predictive indicators and explore new potential targets for clinical treatment, highlighting the need for novel biomarkers and therapeutic targets. We analyzed FBP1 expression in PTC tissues. Cell proliferation, apoptosis, and invasion were evaluated with and without FBP1 overexpression in PTC cells to assess FBP1’s effects. We then investigated whether FBP1 reduces PTC cell tumorigenesis and metastasis by regulating HIF-1α expression. FBP1 expression was reduced in PTC samples and showed a negative correlation with T stage. In vitro experiments indicated that FBP1 acts as a hypoxia response inhibitor, regulating tumor cells. Additionally, FBP1 inhibited the proliferation, apoptosis, and invasion of thyroid cancer cells by modulating HIF-1α expression.  Our results provide new insights into the role of FBP1 in PTC progression and indicate that targeting the FBP1-HIF-1α axis could be a promising therapeutic approach for this disease.","Papillary thyroid tumor, FBP1, HIF-1α, Hypoxia"
Bladder image stitching algorithm for navigation and referencing using a standard cystoscope,"Ming Li, Nicole A. Varble, Sandeep Gurram, Dilara Long, Vladimir Valera, Nikhil Gopal, Ivane Bakhutashvili, Sheridan Reed, William F. Pritchard, John W. Karanian, Sheng Xu, Bradford J. Wood",2024-11-25,"To aid in the diagnosis, monitoring, and surveillance of bladder carcinoma, this study aimed to develop and test an algorithm that creates a referenceable bladder map rendered from standard cystoscopy videos without the need for specialized equipment. A vision-based algorithm was developed to generate 2D bladder maps from individual video frames, by sequentially stitching image frames based on matching surface features, and subsequently localize and track frames during reevaluation. The algorithm was developed and calibrated in a 2D model and 3D anthropomorphic bladder phantom. The performance was evaluated in vivo in swine and with retrospective clinical cystoscopy video. Results showed that the algorithm was capable of capturing and stitching intravesical images with different sweeping patterns. Between 93% and 99% of frames had sufficient features for bladder map generation. Upon reevaluation, the cystoscope accurately localized a frame within 4.5 s. In swine, a virtual mucosal surface map was generated that matched the explant anatomy. A surface map could be generated based on archived patient cystoscopy images. This tool could aid recording and referencing pathologic findings and biopsy or treatment locations for subsequent procedures and may have utility in patients with metachronous bladder cancer and in low-resource settings.","Bladder map, Image stitching, Cystoscope, Cystoscopy"
Impact of graphical display on the intention to undergo risk-reducing salpingo-oophorectomy and mastectomy in individuals positive for BRCA pathogenic variant,"Yoon-Jung Choi, Younju Park, Boyoung Park, Heejung Chae, So-Youn Jung, Kum Hei Ryu, Myong Cheol Lim, Soo Jin Park, Yoon Jung Chang, Sun-Young Kong",2024-10-16,"The BRCA1/2 pathogenic variant (PV) increases the risk of breast and ovarian cancer; thus, risk-reducing salpingo-oophorectomy (RRSO) and mastectomy (RRM) are recommended. We evaluated the effects of the graphical display of cancer risk compared with those of numerical presentation on the decision-making for risk-reducing (RR) surgery. A total of 471 women representing the Korean population were recruited. The lifetime risk of breast/ovarian cancer were given numerically followed by graphically in hypothetical BRCA1/2 PV-positive cases. Subsequently, the study participants were asked for their willingness to undergo RRSO/RRM. When the ovarian cancer risk was shown as 44.0%, the percentage of study participants who chose RRSO was 41.0% after numerical presentation versus 39.9% after graphical display, of which the difference was not significant. When the breast cancer risk was presented as 72.0%, 30.4% of the participants opted for RRM under numerical presentation, whereas this increased to 38.6% under graphical display, of which the difference was significant (p < 0.0075). The average levels of the cancer risk which study participants consider RR surgery were 57.1% for ovarian cancer and 60.6% for breast cancer. This suggests that the impacts of different formats of risk communication on decision about RRSO or RRM may be different by the absolute levels of ovarian or breast cancer.","Genetic testing, BRCA, Graphical presentation, Breast cancer, Ovarian cancer"
Single-cell transcriptomic landscape deciphers olfactory neuroblastoma subtypes and intra-tumoral heterogeneity,"Jingyi Yang, Xiaole Song, Huankang Zhang, Quan Liu, Ruoyan Wei, Luo Guo, Cuncun Yuan, Fu Chen, Kai Xue, Yuting Lai, Li Wang, Junfeng Shi, Chengle Zhou, Juan Wang, Yingxuan Yu, Qibing Mei, Li Hu, Huan Wang, Chen Zhang, Qianqian Zhang, Houyong Li, Ye Gu, Weidong Zhao, Huapeng Yu, Jingjing Wang, Zhuofu Liu, Han Li, Shixing Zheng, Juan Liu, Lu Yang, Wanpeng Li, Rui Xu, Jiani Chen, Yumin Zhou, Xiankui Cheng, Yiqun Yu, Dehui Wang, Xicai Sun, Hongmeng Yu",2024-11-14,"Olfactory neuroblastoma (ONB) is a rare malignancy known to originate from the olfactory epithelium. The complex tumor ecosystem of this pathology remains unclear. Here, we explored the cellular components within ten ONB tumors and one olfactory mucosa sample based on single-cell RNA profiles. We showed the intra-tumoral heterogeneity by identifying five unique expression programs among malignant epithelial cells. A distinct three-classification system (neural, basal, mesenchymal) for ONB was established according to the distinguished gene expression patterns. Biomarkers for categorizing bulk tumors into uncharacterized subtypes were elucidated. Different responses towards certain chemotherapy regimens could be cautiously inferred according to the molecular features representing the three tumor types, thus helping with precision chemotherapy. We also analyzed subclusters of the tumor microenvironment (TME) and the interactions among different cell types within the TME. The relative abundance of immunosuppressive tumor-associated macrophages suggests potential benefits of immunotherapies targeting macrophages.",
Single center evaluation of sensitivity and specificity of CellDetect assay in early bladder cancer patients,"Wenbo Gao, Zhiling Lou",2024-11-24,"Until recently, the main diagnostic methods for bladder cancer (BC) are still voided urine cytology and cystoscopy, and many drawbacks persist. In this retrospective study, we evaluated the sensitivity and specificity of the CellDetect assay in the detection of BC with comparison to standard diagnostic methods. Between August 2020 and July 2022, B-ultrasonography or computed tomography (CT) scan was performed for patients with hematuria or irritative voiding symptoms. If no bladder mass was detected, the patient was excluded. A total of 148 patients with bladder mass formed the final study cohort. The patients’ urine samples were measured with CellDetect assay, followed by cystoscopy or diagnostic transurethral resection of bladder tumor. The patients were divided into two groups based on previous history of BC: group P and group R. The analysis included descriptive statistics and percentages. Finally, 115 cases had a positive CellDetect result, with 68 cases in group P and 47 in group R, respectively. And 134 cases revealed malignant tumor pathologically. The overall sensitivity and specificity for all patients were 82.1% and 64.2%, respectively. Concerning the subgroups, the respective sensitivity and specificity were: in group P- 81.0% and 50.0%; and in group R- 85.2% and 83.3%, respectively. In conclusion, CellDetect assay demonstrated significant performance for diagnosis of BC: it can identify BC patients at early stage with significant diagnostic performance and good reliability. This assay might develop novel methods and ideas for future clinical practice.",
A real-world pharmacovigilance study of amivantamab-related cardiovascular adverse events based on the FDA adverse event reporting system (FAERS) database,"Rui Sun, Zhen Ning, Henan Qin, Wenhe Zhang, Yibin Teng, Chenxing Jin, Jiwei Liu, Aman Wang",2024-04-25,"Amivantamab is the first dual-specificity antibody targeting EGFR and MET, which is approved for the treatment of locally advanced or metastatic non-small cell lung cancer (NSCLC) with EGFR exon 20 insertion mutations. Cardiovascular toxicities related to amivantamab have not been reported in the CHRYSALIS study. However, the occurrence of cardiovascular events in the real world is unknown. To comprehensively investigate the clinical characteristics, onset times, and outcomes of cardiovascular toxicities associated with amivantamab. The Food and Drug Administration Adverse Event Reporting System (FAERS) database from 1st quarter of 2019 to the 2nd quarter of 2023 was retrospectively queried to extract reports of cardiovascular adverse events (AEs) associated with amivantamab. To perform disproportionality analysis, the reporting odds ratios (RORs) and information components (ICs) were calculated with statistical shrinkage trans-formation formulas and a lower limit of the 95% confidence interval (CI) for ROR (ROR025) > 1 or IC (IC025) > 0 with at least 3 reports was considered statistically significant. A total of 20,270,918 eligible records were identified, among which 98 records were related to cardiovascular events associated with amivantamab. 4 categories of cardiovascular events exhibited positive signals: venous thrombotic diseases, abnormal blood pressure, arrhythmia, and pericardial effusion. Venous thrombotic diseases and abnormal blood pressure were the two most common signals. The median time to onset (TTO) for cardiovascular AEs was 33 days. The cumulative incidence within 90 days was 100% for cardiac failure, 75% for stroke, 63.16% for arrhythmia, 50% for sudden death, and 44.18% for venous thrombotic diseases. Death accounted for 16.3% of all cardiovascular AEs associated with amivantamab. The mortality rates for Major Adverse Cardiovascular Events (MACE) were up to 60%. This pharmacovigilance study systematically explored the cardiovascular adverse events of amivantamab and provided new safety signals based on past safety information. Early and intensified monitoring is crucial, and attention should be directed towards high-risk signals.",
