Title,Authors,Date,Abstract,Keywords
A bioinspired sulfur–Fe–heme nanozyme with selective peroxidase-like activity for enhanced tumor chemotherapy,"Shuaibing Zhang, Xuejiao J. Gao, Yuanjie Ma, Kexu Song, Mengyue Ge, Saiyu Ma, Lirong Zhang, Ye Yuan, Wei Jiang, Zhenzhen Wu, Lizeng Gao, Xiyun Yan, Bing Jiang",2024-12-05,"Iron-based nanozymes, recognized for their biocompatibility and peroxidase-like activities, hold promise as catalysts in tumor therapy. However, their concurrent catalase-like activity undermines therapeutic efficacy by converting hydrogen peroxide in tumor tissues into oxygen, thus diminishing hydroxyl radical production. Addressing this challenge, this study introduces the hemin–cysteine–Fe (HCFe) nanozyme, which exhibits exclusive peroxidase-like activity. Constructed through a supramolecular assembly approach involving Fmoc-l-cysteine, heme, and Fe²⁺ coordination, HCFe distinctly incorporates heme and [Fe–S] within its active center. Sulfur coordination to the central Fe atom of Hemin is crucial in modulating the catalytic preference of the HCFe nanozyme towards peroxidase-like activity. This unique mechanism distinguishes HCFe from other bifunctional iron-based nanozymes, enhancing its catalytic selectivity even beyond that of natural peroxidases. This selective activity allows HCFe to significantly elevate ROS production and exert cytotoxic effects, especially against cisplatin-resistant esophageal squamous cell carcinoma (ESCC) cells and their xenografts in female mice when combined with cisplatin. These findings underscore HCFe’s potential as a crucial component in multimodal cancer therapy, notably in augmenting chemotherapy efficacy.",
Phase 1 study of isatuximab monotherapy in Chinese patients with relapsed/refractory multiple myeloma,"Mingyuan Sun, Hongmei Jing, Xiaoyan Qu, Fei Dong, Yi Li, Zhaoyi Feng, Samira Ziti-Ljajic, Dorothee Semiond, Lingyu Li, Junyuan Qi, Lugui Qiu",2024-11-11,"In this multi-center, Phase-1 study (NCT03733717), we characterized the pharmacokinetics (PK) of the anti-CD38 antibody isatuximab (Isa) after IV administration (primary objective), and evaluated safety, immunogenicity, and preliminary anti-myeloma activity in Chinese patients with relapsed/refractory multiple myeloma (RRMM). Isa 20-mg/kg was administered weekly (QW) in cycle 1, then biweekly (Q2W). Twenty-one extensively pretreated RRMM patients (median 4 prior lines; 95.2% refractory to last regimen), received ≥ 1 dose of Isa. After first IV-infusion, mean maximum observed concentration was 402 μg/mL and mean area-under-the-concentration-versus-time curve (first 1-week dosing interval) 37,000 μg·h/mL. After repeated administration, exposure (Ctrough) increased 3.11-folds (day 1/cycle 2) versus first administration (day 8/cycle 1). Safety findings were consistent with the known Isa safety profile, with no new safety signals. Any-causality, grade ≥ 3 treatment-emergent adverse events (TEAEs) were reported in 47.6% of patients. Serious, treatment-related AEs occurred in 2 patients. Isa treatment was generally well tolerated; only 1 patient discontinued due to TEAE. Preliminary efficacy results showed a 19.0% overall response rate (clinical benefit, 33.3%). Our results demonstrate a PK profile for Isa comparable to prior findings in Western and other East-Asian populations, as well as safety and tolerability of treatment with IV Isa 20-mg/kg QW-Q2W in Chinese RRMM patients.Trial registration: The trial was registered with ClinicalTrials.gov; NCT03733717. Date of first trial registration: 07/11/2018.",
Human single cell RNA-sequencing reveals a targetable CD8+ exhausted T cell population that maintains mouse low-grade glioma growth,"Rasha Barakat, Jit Chatterjee, Rui Mu, Xuanhe Qi, Xingxing Gu, Igor Smirnov, Olivia Cobb, Karen Gao, Angelica Barnes, Jonathan Kipnis, David H. Gutmann",2024-11-28,"In solid cancers, T cells typically function as cytotoxic effectors to limit tumor growth, prompting therapies that capitalize upon this antineoplastic property (immune checkpoint inhibition; ICI). Unfortunately, ICI treatments have been largely ineffective for high-grade brain tumors (gliomas; HGGs). Leveraging several single-cell RNA sequencing datasets, we report greater CD8+ exhausted T cells in human pediatric low-grade gliomas (LGGs) relative to adult and pediatric HGGs. Using several preclinical mouse LGG models (Nf1-OPG mice), we show that these PD1+/TIGIT+ CD8+ exhausted T cells are restricted to the tumor tissue, where they express paracrine factors necessary for OPG growth. Importantly, ICI treatments with α-PD1 and α-TIGIT antibodies attenuate Nf1-OPG tumor proliferation through suppression of two cytokine (Ccl4 and TGFβ)-mediated mechanisms, rather than by T cell-mediated cytotoxicity, as well as suppress monocyte-controlled T cell chemotaxis. Collectively, these findings establish a previously unrecognized function for CD8+ exhausted T cells as specialized regulators of LGG maintenance.",
Multiple myeloma long-term survivors exhibit sustained immune alterations decades after first-line therapy,"Raphael Lutz, Florian Grünschläger, Malte Simon, Mohamed H. S. Awwad, Marcus Bauer, Schayan Yousefian, Niklas Beumer, Lea Jopp-Saile, Anastasia Sedlmeier, Llorenç Solé-Boldo, Bogdan Avanesyan, Dominik Vonficht, Patrick Stelmach, Georg Steinbuss, Tobias Boch, Simon Steiger, Marc-Andrea Baertsch, Nina Prokoph, Karsten Rippe, Brian G. M. Durie, Claudia Wickenhauser, Andreas Trumpp, Carsten Müller-Tidow, Daniel Hübschmann, Niels Weinhold, Marc S. Raab, Benedikt Brors, Hartmut Goldschmidt, Charles D. Imbusch, Michael Hundemer, Simon Haas",2024-11-29,"The long-term consequences of cancer and its therapy on the patients’ immune system years after cancer-free survival remain poorly understood. Here, we present an in-depth characterization of the bone marrow immune ecosystem of multiple myeloma long-term survivors, from initial diagnosis up to 17 years following a single therapy line and cancer-free survival. Using comparative single-cell analyses combined with molecular, genomic, and functional approaches, we demonstrate that multiple myeloma long-term survivors exhibit pronounced alterations in their bone marrow microenvironment associated with impaired immunity. These immunological alterations were frequently linked to an inflammatory immune circuit fueled by the long-term persistence or resurgence of residual myeloma cells. Notably, even in the complete absence of any detectable residual disease for decades, sustained changes in the immune system were observed, suggesting an irreversible ‘immunological scarring’ caused by the initial exposure to the cancer and therapy. Collectively, our study provides key insights into the molecular and cellular bone marrow ecosystem of long-term survivors of multiple myeloma, revealing both reversible and irreversible alterations in the immune compartment.",
DUSP6 regulates Notch1 signalling in colorectal cancer,"Chin Wen Png, Madhushanee Weerasooriya, Heng Li, Xiaowen Hou, Fiona Yayuan Teo, Shiying Huang, Zheng Ser, Franklin Yau Kok Weng, Malini Rethnam, Gloryn Chia, Radoslaw M. Sobota, Choon Seng Chong, Ker-Kan Tan, Yongliang Zhang",2024-11-21,"Notch1 plays various roles in cancer development, and Notch1-induced transactivation is controlled by phosphorylation of its cleaved intracellular domain. However, it is unclear whether there are phosphatases capable of dephosphorylating the cleaved Notch1 transmembrane/intracellular region (NTM) to regulate its function. Here, we show that DUSP6 can function as a phosphatase for Notch1, thereby regulating NTM stability and transcriptional activity, thus influencing colorectal cancer (CRC) development. In human CRC cells, elevated DUSP6 expression correlates with increased NTM levels, leading to enhanced CRC cell proliferation both in vitro and in vivo. High tumoral DUSP6 protein expression is associated with poorer overall CRC patient survival. In mice, DUSP6 deficiency results in reduced CRC development. Mechanistically, DUSP6 dephosphorylates phospho-Y2116, which in turn reduces NTM ubiquitination, leading to increased NTM stability and transcriptional activity. As a result, the expression of Notch1-targeted proliferation genes is increased to promote tumour cell growth.",
Follicular lymphoma,,2019-12-12,No Abstract,
"Descriptive analysis of incidence, demographic characteristics, and survival outcomes of soft-tissue sarcoma of the extremities in Saudi Arabia","Wazzan Aljuhani, Abdullah Alanazi, Eyad Alshehri, Mohammed K Alageel, Emad Masuadi, Mostafa Zolaly, Abdulrahman Bobsait",2024-11-25,No Abstract,"Soft-tissue sarcomas, Malignant tumors, Saudi Cancer Registry, Limb sarcoma, Liposarcoma, Rhabdomyosarcoma"
Cell polarity proteins promote macropinocytosis in response to metabolic stress,"Guillem Lambies, Szu-Wei Lee, Karen Duong-Polk, Pedro Aza-Blanc, Swetha Maganti, Cheska M. Galapate, Anagha Deshpande, Aniruddha J. Deshpande, David A. Scott, David W. Dawson, Cosimo Commisso",2024-12-03,"Macropinocytosis has emerged as a scavenging pathway that cancer cells exploit to survive in a nutrient-deprived microenvironment. Tumor cells are especially reliant on glutamine for their survival, and in pancreatic ductal adenocarcinoma (PDAC) cells, glutamine deficiency can enhance the stimulation of macropinocytosis. Here, we identify the atypical protein kinase C (aPKC) enzymes, PKCζ and PKCι, as regulators of macropinocytosis. In normal epithelial cells, aPKCs associate with the scaffold proteins Par3 and Par6 to regulate cell polarity, affecting several targets, including the Par1 kinases and we find that each of these proteins is required for macropinocytosis. Mechanistically, aPKCs are regulated by EGFR signaling or by the transcription factor CREM to promote the Par3 relocation to microtubules, facilitating macropinocytosis in a dynein-dependent manner. Importantly, cell fitness impairment caused by aPKC depletion is rescued by the restoration of macropinocytosis and aPKCs support PDAC growth in vivo. Our findings enhance our understanding of the mechanistic underpinnings that control macropinocytic uptake in the context of metabolic stress.",
High-resolution profile of neoantigen-specific TCR activation links moderate stimulation to increased resilience of engineered TCR-T cells,"Franziska Füchsl, Johannes Untch, Vladyslav Kavaka, Gabriela Zuleger, Sarah Braun, Antonia Schwanzer, Sebastian Jarosch, Carolin Vogelsang, Niklas de Andrade Krätzig, Dario Gosmann, Rupert Öllinger, Piero Giansanti, Michael Hiltensperger, Roland Rad, Dirk H. Busch, Eduardo Beltrán, Eva Bräunlein, Angela M. Krackhardt",2024-12-03,"Neoantigen-specific T cell receptors (neoTCRs) promise safe, personalized anti-tumor immunotherapy. However, detailed assessment of neoTCR-characteristics affecting therapeutic efficacy is mostly missing. Previously, we identified diverse neoTCRs restricted to different neoantigens in a melanoma patient. In this work, we now combine single-cell TCR-sequencing and RNA-sequencing after neoantigen-specific restimulation of peripheral blood-derived CD8+ T cells of this patient. We detect neoTCRs with specificity for the previously detected neoantigens and perform fine-characterization of neoTCR-transgenic (tg) T cells in vitro and in vivo. We describe a heterogeneous spectrum of TCR-intrinsic activation patterns in response to a shared neoepitope ranging from previously detected more highly frequent neoTCRs with moderate activation to rare ones with initially stronger activation. Experimental restimulation of adoptively transferred neoTCR-tg T cells in a xenogeneic rechallenge tumor model demonstrates superior anti-tumor responses of moderate neoTCR-tg T cells upon repeated tumor contact. These insights have significant implications for the selection of TCRs for therapeutic engineering of TCR-tg T cells.",
Tumor-derived miR-9-5p-loaded EVs regulate cholesterol homeostasis to promote breast cancer liver metastasis in mice,"Mei-Xin Li, Sheng Hu, He-Hua Lei, Meng Yuan, Xu Li, Wen-Kui Hou, Xiang-Jie Huang, Bing-Wen Xiao, Teng-Xiang Yu, Xiao-Hui Zhang, Xiao-Ting Wu, Wen-Qiang Jing, Hyeon-Jeong Lee, Juan-Juan Li, Da Fu, Li-Min Zhang, Wei Yan",2024-12-03,"Cancer cells secrete extracellular vesicles (EV) encapsulating bioactive cargoes to facilitate inter-organ communication in vivo and are emerging as critical mediators of tumor progression and metastasis, a condition which is often accompanied by a dysregulated cholesterol metabolism. Whether EVs are involved in the control of cholesterol homeostasis during tumor metastasis is still undefined and warrant further investigation. Here, we find that breast cancer-derived exosomal miR-9-5p induces the expression of HMGCR and CH25H, two enzymes involved in cholesterol synthesis and the conversion of 25-hydroxycholesterol from cholesterol by targeting INSIG1, INSIG2 and ATF3 genes in the liver. Notably, in vivo miR-9-5p antagomir treatment and genetic CH25H ablation prevents tumor metastasis in a mouse model of breast cancer. Thus, our findings reveal the regulatory mechanism of tumor-derived miR-9-5p in liver metastasis by linking oxysterol metabolism and Kupffer cell polarization, shedding light on future applications for cancer diagnosis and treatment.",
Dual rectification of metabolism abnormality in pancreatic cancer by a programmed nanomedicine,"Bowen Wu, Zhiqin Wang, Jingyuan Liu, Naishi Li, Xudong Wang, HaoChen Bai, Chunling Wang, Jian Shi, Saiyang Zhang, Jian Song, Yiye Li, Guangjun Nie",2024-12-03,"Pancreatic ductal adenocarcinoma (PDAC) is a highly aggressive and lethal malignancy characterized by dysregulated energy and stromal metabolism. It is strongly supported by activated pancreatic stellate cells (PSC) which drive excessive desmoplasia and tumor growth via metabolic crosstalk. Herein, a programmed nanosystem is designed to dual rectify the metabolism abnormalities of the PDAC cells, which overexpress glucose transporter 1(GLUT1) and CD71, and the PSC for oncotherapy. The nanosystem is based on a tumor microenvironment-responsive liposome encapsulating an NF-κB inhibitor (TPCA-1) and a CD71 aptamer-linked Glut1 siRNA. TPCA-1 reverses the activated PSC to quiescence, which hampers metabolic support of the PSC to PDAC cells and bolsters the PDAC cell-targeting delivery of the siRNA. Aerobic glycolysis and the following enhancement of oxidative phosphorylation are restrained by the nano-modulation so as to amplify anti-PDAC efficacy in an orthotopic xenograft mouse model, which implies more personalized PDAC treatment based on different energy metabolic profiles.",
Testicular cancer,,2018-10-05,No Abstract,
Comparative analysis of the safety and feasibility of laparoscopic and open approaches for right anterior sectionectomy,"Wen Li, Haitao Zeng, Yong Huang",2024-12-04,"Laparoscopic hepatectomy has minimally invasive advantages, but reports on laparoscopic right anterior sectionectomy (LRAS) are rare. Herein, we try to explore the benefits and drawbacks of LRAS by comparing it with open right anterior sectionectomy (ORAS). Between January 2015 and September 2023, 39 patients who underwent LRAS (n = 18) or ORAS (n = 21) were enrolled in the study. The patients’ characteristics, intraoperative details, and postoperative outcomes were compared between the two groups. No significant differences in the preoperative data were observed between the two groups. The LRAS group had significantly lesser blood loss (P = 0.019), a shorter hospital stay (P = 0.045), and a higher rate of bile leak (P = 0.039) than the ORAS group. There was no significant difference in the operative time (P = 0.156), transfusion rate (P = 0.385), hospital expenses (P = 0.511), rate of other complications, postoperative white blood cell count, and alanine aminotransferase and aspartate aminotransferase levels between the two groups (P > 0.05). Beside, there was no significant difference in disease-free survival (P = 0.351) or overall survival (P = 0.613) in patients with hepatocellular carcinoma between the two groups. LRAS is a safe and feasible surgical procedure. It may be preferred for lesions in the right anterior lobe of the liver.","Laparoscopic, Hepatectomy, Right anterior lobe, Liver"
HER2-related biomarkers predict clinical outcomes with trastuzumab deruxtecan treatment in patients with HER2-expressing metastatic colorectal cancer: biomarker analyses of DESTINY-CRC01,"Salvatore Siena, Kanwal Raghav, Toshiki Masuishi, Kensei Yamaguchi, Tomohiro Nishina, Elena Elez, Javier Rodriguez, Ian Chau, Maria Di Bartolomeo, Hisato Kawakami, Fumitaka Suto, Makito Koga, Koichiro Inaki, Yusuke Kuwahara, Issey Takehara, Daniel Barrios, Kojiro Kobayashi, Axel Grothey, Takayuki Yoshino",2024-11-25,"DESTINY-CRC01 (NCT03384940) was a multicentre, open-label, phase 2 study that investigated the safety and efficacy of trastuzumab deruxtecan (T-DXd) in patients with human epidermal growth factor receptor 2 (HER2)-expressing metastatic colorectal cancer (CRC). The present exploratory biomarker analysis aims to investigate relationships between biomarkers and clinical outcomes in patients with HER2-positive (immunohistochemistry [IHC] 3+ or IHC 2+ and in situ hybridization [ISH] positive) Cohort A (N = 53) of DESTINY-CRC01. Higher levels of HER2 biomarkers in baseline tissue and liquid biopsies, including HER2 status (IHC/ISH), HER2/CEP17 ratio, HER2 ISH signals, HER2 H-score, plasma HER2 (ERBB2) amplification status, HER2 adjusted plasma copy number, and HER2 extracellular domain correlate with antitumor activity (indicated by objective response rate, progression-free survival, and overall survival) of T-DXd. Baseline circulating tumor DNA (ctDNA) analysis suggests antitumor activity of T-DXd in patients who had baseline activating RAS, PIK3CA, or HER2 mutations detected in ctDNA.",
Multi-institutional report of trastuzumab deruxtecan and stereotactic radiosurgery for HER2 positive and HER2-low breast cancer brain metastases,"Vaseem M. Khatri, Mariella A. Mestres-Villanueva, Sreenija Yarlagadda, Ajay Doniparthi, David B. Smith, Justyn Y. Nakashima, John M. Bryant, Dekuang Zhao, Rituraj Upadhyay, Matthew N. Mills, Daniel E. Oliver, Hsiang-Hsuan Michael Yu, Joshua D. Palmer, Nicole O. Williams, Reshma L. Mahtani, Manmeet S. Ahluwalia, Hatem H. Soliman, Hyo S. Han, Aixa E. Soyano, Youngchul Kim, Rupesh Kotecha, Sasha J. Beyer, Kamran A. Ahmed",2024-11-21,"Trastuzumab-deruxtecan (T-DXd) has demonstrated intracranial efficacy; however, safety and efficacy data remains limited with stereotactic radiosurgery (SRS). A multi-institutional review was performed with HER2+ or HER2-low metastatic breast cancer treated with T-DXd and SRS for active brain metastases. We identified 215 lesions treated over 48 SRS courses in 34 patients. Median follow up from T-DXd initiation was 13.9 months. The cumulative incidence of symptomatic radiation necrosis at 24 months per lesion was 2.1% and per patient 11%. The 12-month LC was 97%. HER2-low was associated with worse distant intracranial control (DIC) (adjusted HR 2.5, 95% CI 1.1–5.6, p = 0.03) and worse systemic progression free survival (PFS) (HR 4.1, 95% CI 1.6–10.7, p = 0.004). Concurrent SRS and T-DXd has excellent local control, without an increased risk of radiation necrosis. HER2-low disease is associated with worse systemic PFS and DIC with T-DXd compared to HER2+.",
Early evolutionary branching across spatial domains predisposes to clonal replacement under chemotherapy in neuroblastoma,"Jenny Karlsson, Hiroaki Yasui, Adriana Mañas, Natalie Andersson, Karin Hansson, Kristina Aaltonen, Caroline Jansson, Geoffroy Durand, Naveen Ravi, Michele Ferro, Minjun Yang, Subhayan Chattopadhyay, Kajsa Paulsson, Diana Spierings, Floris Foijer, Anders Valind, Daniel Bexell, David Gisselsson",2024-10-18,"Neuroblastoma (NB) is one of the most lethal childhood cancers due to its propensity to become treatment resistant. By spatial mapping of subclone geographies before and after chemotherapy across 89 tumor regions from 12 NBs, we find that densely packed territories of closely related subclones present at diagnosis are replaced under effective treatment by islands of distantly related survivor subclones, originating from a different most recent ancestor compared to lineages dominating before treatment. Conversely, in tumors that progressed under treatment, ancestors of subclones dominating later in disease are present already at diagnosis. Chemotherapy treated xenografts and cell culture models replicate these two contrasting scenarios and show branching evolution to be a constant feature of proliferating NB cells. Phylogenies based on whole genome sequencing of 505 individual NB cells indicate that a rich repertoire of parallel subclones emerges already with the first oncogenic mutations and lays the foundation for clonal replacement under treatment.",
Generalizable and automated classification of TNM stage from pathology reports with external validation,"Jenna Kefeli, Jacob Berkowitz, Jose M. Acitores Cortina, Kevin K. Tsang, Nicholas P. Tatonetti",2024-10-16,"Cancer staging is an essential clinical attribute informing patient prognosis and clinical trial eligibility. However, it is not routinely recorded in structured electronic health records. Here, we present BB-TEN: Big Bird – TNM staging Extracted from Notes, a generalizable method for the automated classification of TNM stage directly from pathology report text. We train a BERT-based model using publicly available pathology reports across approximately 7000 patients and 23 cancer types. We explore the use of different model types, with differing input sizes, parameters, and model architectures. Our final model goes beyond term-extraction, inferring TNM stage from context when it is not included in the report text explicitly. As external validation, we test our model on almost 8000 pathology reports from Columbia University Medical Center, finding that our trained model achieved an AU-ROC of 0.815–0.942. This suggests that our model can be applied broadly to other institutions without additional institution-specific fine-tuning.",
Somatic mutations in 3929 HPV positive cervical cells associated with infection outcome and HPV type,"Maisa Pinheiro, Nicolas Wentzensen, Michael Dean, Meredith Yeager, Zigui Chen, Amulya Shastry, Joseph F. Boland, Sara Bass, Laurie Burdett, Thomas Lorey, Sambit Mishra, Philip E. Castle, Mark Schiffman, Robert D. Burk, Bin Zhu, Lisa Mirabello",2024-09-12,"Invasive cervical cancers (ICC), caused by HPV infections, have a heterogeneous molecular landscape. We investigate the detection, timing, and HPV type specificity of somatic mutations in 3929 HPV-positive exfoliated cervical cell samples from individuals undergoing cervical screening in the U.S. using deep targeted sequencing in ICC cases, precancers, and HPV-positive controls. We discover a subset of hotspot mutations rare in controls (2.6%) but significantly more prevalent in precancers, particularly glandular precancer lesions (10.2%), and cancers (25.7%), supporting their involvement in ICC carcinogenesis. Hotspot mutations differ by HPV type, and HPV18/45-positive ICC are more likely to have multiple hotspot mutations compared to HPV16-positive ICC. The proportion of cells containing hotspot mutations is higher (i.e., higher variant allele fraction) in ICC and mutations are detectable up to 6 years prior to cancer diagnosis. Our findings demonstrate the feasibility of using exfoliated cervical cells for detection of somatic mutations as potential diagnostic biomarkers.",
Neoadjuvant tislelizumab plus stereotactic body radiotherapy and adjuvant tislelizumab in early-stage resectable hepatocellular carcinoma: the Notable-HCC phase 1b trial,"Zhongchao Li, Jing Liu, Bo Zhang, Jinbo Yue, Xuetao Shi, Kai Cui, Zhaogang Liu, Zhibin Chang, Zhicheng Sun, Mingming Li, Yue Yang, Zhao Ma, Lei Li, Chengsheng Zhang, Pengfei Sun, Jingtao Zhong, Lei Zhao",2024-04-16,"Notable-HCC (NCT05185531) is a phase 1b trial, aiming to evaluate the safety and preliminary effectiveness of neoadjuvant PD-1 blockade plus stereotactic body radiotherapy (SBRT) in early-stage resectable hepatocellular carcinoma (HCC). Twenty patients with HCC of BCLC stage 0-A received 3\(\times \) Gy SBRT and two cycles of tislelizumab, an anti-PD-1 monoclonal antibody before the curative HCC resection. Primary endpoints were the surgery delay, radiographic and pathological tumor response after the neoadjuvant therapy, safety and tolerability. During the neoadjuvant therapy, treatment-related adverse events (TRAEs) of grade 1-2 occurred in all 20 patients (100%), eight patients (40%) had grade 3 TRAEs, no grade 4 to 5 TRAE occurred, and all resolved without corticosteroids treatment. Per mRECIST, the objective response rate was 63.2% (12/19), with 3 complete response; the disease control rate was 100%. Two (10.5%) patients achieved complete pathological response. No surgery delay occurred. The neoadjuvant therapy did not increase the surgical difficulty or the incidence of complications. Secondary endpoints of disease-free survival and overall survival were not mature at the time of the analysis. Our pilot trial shows that neoadjuvant therapy with anti-PD-1 + SBRT is safe and promotes tumor responses in early-stage resectable HCC.",
