Title,Authors,Date,Abstract,Keywords
Evaluation of thermal effects of surgical energy devices: ex vivo study,"Toshiharu Morikawa, Shuzo Hamamoto, Masakazu Gonda, Kazumi Taguchi, Rei Unno, Koei Torii, Masahiko Isogai, Kengo Kawase, Takashi Nagai, Shoichiro Iwatsuki, Toshiki Etani, Taku Naiki, Atsushi Okada, Takahiro Yasui",2024-11-09,"This study evaluated the direct and indirect thermal effects of various surgical energy devices using an ex-vivo model. Two types of three devices were evaluated: ENSEAL™ X1 Curved Jaw Tissue Sealer (X1) and ENSEAL™ G2 Curved Tissue Sealer (G2) as vessel sealing systems (VSSs), and HARMONIC® HD1000i Shears (HA) as an ultrasonic activating device (USAD). Each device was activated once under DRY or WET conditions. The tissue’s maximum temperature (MT), steam MT surrounding the activation site, and steam spread area (SSA) were measured. Under WET conditions, the median MT of a porcine common carotid artery at 1 mm from the activation site by X1, G2, and HA were 84.4, 83.3, and 50.5 °C, respectively. The direct thermal effect of HA was the lowest among the three devices. VSSs showed higher tissue MT under WET conditions compared with DRY conditions. Conversely, USAD showed the opposite trend. G2 demonstrated a significantly higher MT than X1 and HA (P < 0.05). A significant decrease in SSA was observed with decreasing grasping range. In conclusion, VSSs generated higher temperatures than USAD, especially under WET conditions. Surgeons should consider minimizing thermal effects by creating DRY conditions or performing gradual incisions when using VSS devices.","Vessel sealing system, Ultrasonic activating device, Thermal effect, Grasping range, Steam spread area, WET condition"
Identifying key circulating tumor DNA parameters for predicting clinical outcomes in metastatic non-squamous non-small cell lung cancer after first-line chemoimmunotherapy,"Haolun Ding, Min Yuan, Yaning Yang, Xu Steven Xu",2024-08-10,"Circulating tumor DNA (ctDNA) provides valuable tumor-related information without invasive biopsies, yet consensus is lacking on optimal parameters for predicting clinical outcomes. Utilizing longitudinal ctDNA data from the large phase 3 IMpower150 study (NCT02366143) of atezolizumab in combination with chemotherapy with or without bevacizumab in patients with stage IV non-squamous Non-Small Cell Lung Cancer (NSCLC), here we report that post-treatment ctDNA response correlates significantly with radiographic response. However, only modest concordance is identified, revealing that ctDNA response is likely not a surrogate for radiographic response; both provide distinct information. Various ctDNA metrics, especially early ctDNA nadirs, emerge as primary predictors for progression-free survival and overall survival, potentially better assessing long-term benefits for chemoimmunotherapy in NSCLC. Integrating radiographic and ctDNA assessments enhances prediction of survival outcomes. We also identify optimal cutoff values for risk stratification and key assessment timepoints, notably Weeks 6–9, for insights into clinical outcomes. Overall, our identified optimal ctDNA parameters can enhance the prediction of clinical outcomes, refine trial designs, and inform therapeutic decisions for first-line NSCLC patients.",
Late-line options for patients with metastatic colorectal cancer: a review and evidence-based algorithm,"Paolo Ciracì, Vittorio Studiale, Ada Taravella, Carlotta Antoniotti, Chiara Cremolini",2024-11-18,"Over the past few years, several novel systemic treatments have emerged for patients with treatment-refractory metastatic colorectal cancer, thus making selection of the most effective later-line therapy a challenge for medical oncologists. Over the past decade, regorafenib and trifluridine–tipiracil were the only available drugs and often provided limited clinical benefit compared to best supportive care. Results from subsequent practice-changing trials opened several novel therapeutic avenues, both for unselected patients (such as trifluridine–tipiracil plus bevacizumab or fruquintinib) and for subgroups defined by the presence of actionable alterations in their tumours (such as HER2-targeted therapies or KRASG12C inhibitors) or with no acquired mechanisms of resistance to the previously received targeted agents in circulating tumour DNA (such as retreatment with anti-EGFR antibodies). In this Review, we provide a comprehensive overview of advances in the field over the past few years and offer a practical perspective on translation of the most relevant results into the daily management of patients with metastatic colorectal cancer using an evidence-based algorithm. Finally, we discuss some of the most appealing ongoing areas of research and highlight approaches with the potential to further expand the therapeutic armamentarium.",
Cancer burden in low-income and middle-income countries,"Sharmila Anandasabapathy, Chite Asirwa, Surbhi Grover, Chemtai Mungo",2024-02-08,No Abstract,
Impact of renal impairment on early development of severe neutropenia with trifluridine/tipiracil treatment for metastatic colorectal cancer,"Yoshitaka Saito, Yoh Takekuma, Yoshito Komatsu, Mitsuru Sugawara",2024-11-06,"Trifluridine/tipiracil (FTD/TPI) with or without bevacizumab is an effective treatment for metastatic colorectal cancer (mCRC). As this agent is mainly excreted via the kidney, we aimed to evaluate the impact of renal impairment (RI) on the early development of severe neutropenia, a dose-limiting toxicity and whose development reflects better treatment outcomes, in patients with mCRC treated with FTD/TPI. Patients with mCRC receiving FTD/TPI ± bevacizumab (n = 100) were divided into the RI group (creatinine clearance [CCr] < 90 mL/min) or control group (CCr ≥ 90 mL/min), and retrospectively evaluated. Severe neutropenia during the first two cycles occurred in 57.6% and 34.2% of patients in the RI and control groups, respectively, which was significantly different (P = 0.03) and met our primary endpoint. Furthermore, the incidence during the first cycle also differed significantly (52.5% in the RI group and 17.1% in the control group, P = 0.0004). Multivariate logistic regression analysis suggested that baseline RI and neutropenia were significant risk factors for early severe neutropenia (adjusted odds ratio and 95% confidence interval: 3.07, 1.24–7.59, P = 0.02 for RI, and 9.76, 1.08–88.11, P = 0.04 for neutropenia). In conclusion, our study suggested that patients with RI can exhibit early severe neutropenia during real-world FTD/TPI treatment for mCRC.","Trifluridine/tipiracil, Renal impairment, Severe neutropenia, Bevacizumab, Risk factor"
Detection of IDH mutation in glioma by desorption electrospray ionization (DESI) tandem mass spectrometry,"Mahdiyeh Shahi, Steven Pringle, Michael Morris, Diogo Moniz Garcia, Alfredo Quiñones-Hinojosa, R. Graham Cooks",2024-11-06,"Desorption electrospray ionization (DESI) tandem mass spectrometry (MS) is used to assess mutation status of isocitrate dehydrogenase (IDH) in human gliomas. Due to the diffuse nature of gliomas, total gross resection is not normally achieved during surgery, leading to tumor recurrence. The mutation status of IDH has clinical significance due to better prognosis in IDH-mutant patients. The mutant IDH converts alpha-ketoglutaric acid (α-KG) into 2-hydroxyglutarate (2HG), which accumulates abnormally in cells. Immunohistochemical staining (IHC) and genetic testing, the gold standards, are incompatible with intraoperative applications but DESI tandem mass spectrometry (MS/MS) can be used to assess the mutation status of IDH enzyme from tissue intraoperatively. Here, on off-line evaluation is made of the performance of two different types of mass spectrometers in characterization of IDH mutation status. The intensity of 2HG is measured against glutamate (Glu), an intrinsic reference molecule, in both tandem MS measurements. In both cases using DESI clear separation between IDH-mutant (mut) and IDH-wildtype (wt) samples (p < 0.0001) is observed, despite the short analysis time. Due to the higher detection sensitivity, multiple reaction monitoring experiments using a triple quadrupole show slightly better performance compared to product ion MS/MS performed on a simple linear ion trap. Both DESI-MS platforms are capable of providing information on IDH mutation status, which might in future be used at the time of surgery to support decision-making on resection regions, especially at tumor margins.","Multiple reaction monitoring (MRM), 2-hydroxyglutarate, Oncometabolite, Molecular diagnostics, Brain cancer, Ambient ionization"
Busulfan and cyclophosphamide for autologous stem cell transplantation in patients with multiple myeloma after proteasome inhibitor and/or immunomodulatory drug treatment,"Min Ji Jeon, Eun Sang Yu, Dae Sik Kim, Byung-Hyun Lee, Se Ryeon Lee, Hwa Jung Sung, Chul Won Choi, Yong Park, Byung Soo Kim, Ka-Won Kang",2024-11-05,"High-dose melphalan at 200 mg/m2 (MEL-200) is the standard conditioning regimen before autologous stem cell transplantation (ASCT) in patients with multiple myeloma (MM). Busulfan (BU) and cyclophosphamide (CY) can be used as alternatives when MEL is unavailable. However, most studies on BU/CY conditioning regimens were conducted before proteasome inhibitors (PIs) and immunomodulatory drugs (IMIDs) were available. This non-interventional comparative cohort study compared progression-free survival (PFS) between the MEL-200 and BU/CY in patients with MM treated with PIs and/or IMIDs. A total of 137 patients were analyzed (MEL-200,113 patients; BU/CY, 24 patients). The BU/CY group had a higher rate of PI and/or IMID use and very good partial response (VGPR) or complete remission (CR) at ASCT and post-ASCT maintenance. Median PFS was 29.7 and 46.8 months in the MEL-200 and BU/CY groups, respectively. In the multivariate analysis, PFS was significantly better in the BU/CY group. International Staging System Stage I and VGPR or CR at ASCT were significantly associated with longer PFS. No treatment-related mortality was observed in either group by day 100. The BU/CY conditioning regimen may be a viable alternative to the MEL-200 regimen in patients with MM who undergo ASCT after treatment with PIs and/or IMIDs.","Multiple myeloma, Autologous stem cell transplantation, Melphalan, Busulfan, Cyclophosphamide"
Prostaglandin E2-EP2/EP4 signaling induces immunosuppression in human cancer by impairing bioenergetics and ribosome biogenesis in immune cells,"Siwakorn Punyawatthananukool, Ryuma Matsuura, Thamrong Wongchang, Nao Katsurada, Tatsuaki Tsuruyama, Masaki Tajima, Yutaka Enomoto, Toshio Kitamura, Masahiro Kawashima, Masakazu Toi, Koji Yamanoi, Junzo Hamanishi, Shigeo Hisamori, Kazutaka Obama, Varodom Charoensawan, Dean Thumkeo, Shuh Narumiya",2024-11-01,"While prostaglandin E2 (PGE2) is produced in human tumor microenvironment (TME), its role therein remains poorly understood. Here, we examine this issue by comparative single-cell RNA sequencing of immune cells infiltrating human cancers and syngeneic tumors in female mice. PGE receptors EP4 and EP2 are expressed in lymphocytes and myeloid cells, and their expression is associated with the downregulation of oxidative phosphorylation (OXPHOS) and MYC targets, glycolysis and ribosomal proteins (RPs). Mechanistically, CD8+ T cells express EP4 and EP2 upon TCR activation, and PGE2 blocks IL-2-STAT5 signaling by downregulating Il2ra, which downregulates c-Myc and PGC-1 to decrease OXPHOS, glycolysis, and RPs, impairing migration, expansion, survival, and antitumor activity. Similarly, EP4 and EP2 are induced upon macrophage activation, and PGE2 downregulates c-Myc and OXPHOS in M1-like macrophages. These results suggest that PGE2-EP4/EP2 signaling impairs both adaptive and innate immunity in TME by hampering bioenergetics and ribosome biogenesis of tumor-infiltrating immune cells.",
The association between breast cancer and lung cancer: a bidirectional Mendelian randomization study,"Xiaoqian Li, Junjie Liu, Jingyi Zhang, Yidi Wang, Jianjun He, Huimin Zhang",2024-11-06,"With increasing life spans, breast cancer (BC) survivors may face the possibility of developing second primary cancer (SPC), which can considerably shorten survival. Lung cancer (LC) is a common SPC among BC survivors. This study explored the association between these two cancers through Mendelian randomization (MR) analysis. A bidirectional two-sample MR analysis was conducted with BC genome-wide association study (GWAS) data from the Breast Cancer Association Consortium (BCAC) included 228,951 individuals and the GWAS summary statistics from the Transdisciplinary Research in Cancer of the Lung (TRICL) of LC included 112,781 individuals. The IVW method and MR-RAPS method showed a causal effect of overall BC on lung adenocarcinoma (LUAD) (IVW: OR = 1.060, 95% CI = 1.008–1.116, P = 0.024; MR-RAPS: OR = 1.059, 95% CI = 1.005–1.116, P = 0.033), which indicated that patients with BC had an increased risk of LUAD. However, there is no strong evidence for a causal effect of LUAD on BC. Our study revealed a causal effect of BC on second primary LUAD, suggesting that we should intensify screening for second primary LC in BC survivors. Early intervention and treatment for patients with second primary LC are needed to reduce mortality in BC survivors.","Breast cancer, Lung cancer, Mendelian randomization, Causal effect"
53BP1 loss elicits cGAS-STING-dependent antitumor immunity in ovarian and pancreatic cancer,"Yajie Sun, Jeffrey Patterson-Fortin, Sen Han, Zhe Li, Zuzanna Nowicka, Yuna Hirohashi, Susan Kilgas, Jae Kyo Yi, Alexander Spektor, Wojciech Fendler, Panagiotis A. Konstantinopoulos, Dipanjan Chowdhury",2024-08-06,"53BP1 nucleates the anti-end resection machinery at DNA double-strand breaks, thereby countering BRCA1 activity. Loss of 53BP1 leads to DNA end processing and homologous recombination in BRCA1-deficient cells. Consequently, BRCA1-mutant tumors, typically sensitive to PARP inhibitors (PARPi), become resistant in the absence of 53BP1. Here, we demonstrate that the ‘leaky’ DNA end resection in the absence of 53BP1 results in increased micronuclei and cytoplasmic double-stranded DNA, leading to activation of the cGAS-STING pathway and pro-inflammatory signaling. This enhances CD8+ T cell infiltration, activates macrophages and natural killer cells, and impedes tumor growth. Loss of 53BP1 correlates with a response to immune checkpoint blockade (ICB) and improved overall survival. Immunohistochemical assessment of 53BP1 in two malignancies, high grade serous ovarian cancer and pancreatic ductal adenocarcinoma, which are refractory to ICBs, reveals that lower 53BP1 levels correlate with an increased adaptive and innate immune response. Finally, BRCA1-deficient tumors that develop resistance to PARPi due to the loss of 53BP1 are susceptible to ICB. Therefore, we conclude that 53BP1 is critical for tumor immunogenicity and underpins the response to ICB. Our results support including 53BP1 expression as an exploratory biomarker in ICB trials for malignancies typically refractory to immunotherapy.",
Nivolumab plus platinum-doublet chemotherapy in treatment-naive patients with advanced grade 3 Neuroendocrine Neoplasms of gastroenteropancreatic or unknown origin: The multicenter phase 2 NICE-NEC trial (GETNE-T1913),"Maria Carmen Riesco-Martinez, Jaume Capdevila, Vicente Alonso, Paula Jimenez-Fonseca, Alex Teule, Enrique Grande, Isabel Sevilla, Marta Benavent, Teresa Alonso-Gordoa, Ana Custodio, Beatriz Anton-Pascual, Jorge Hernando, Eduardo Polo, Oscar Alfredo Castillo-Trujillo, Arantza Lamas-Paz, Ana Teijo, Yolanda Rodriguez-Gil, Beatriz Soldevilla, Rocio Garcia-Carbonero",2024-08-08,"The prognosis of patients with advanced high-grade (G3) digestive neuroendocrine neoplasms (NENs) is rather poor. The addition of immune checkpoint inhibition to platinum-based chemotherapy may improve survival. NICE-NEC (NCT03980925) is a single-arm, phase II trial that recruited chemotherapy-naive, unresectable advanced or metastatic G3 NENs of gastroenteropancreatic (GEP) or unknown origin. Patients received nivolumab 360 mg intravenously (iv) on day 1, carboplatin AUC 5 iv on day 1, and etoposide 100 mg/m2/d iv on days 1–3, every 3 weeks for up to six cycles, followed by nivolumab 480 mg every 4 weeks for up to 24 months, disease progression, death or unacceptable toxicity. The primary endpoint was the 12-month overall survival (OS) rate (H0 50%, H1 72%, β 80%, α 5%). Secondary endpoints were objective response rate (ORR), duration of response (DoR), progression-free survival (PFS), and safety. From 2019 to 2021, 37 patients were enrolled. The most common primary sites were the pancreas (37.8%), stomach (16.2%) and colon (10.8%). Twenty-five patients (67.6%) were poorly differentiated carcinomas (NECs) and/or had a Ki67 index >55%. The ORR was 56.8%. Median PFS was 5.7 months (95%CI: 5.1-9) and median OS 13.9 months (95%CI: 8.3-Not reached), with a 12-month OS rate of 54.1% (95%CI: 40.2-72.8) that did not meet the primary endpoint. However, 37.6% of patients were long-term survivors (>2 years). The safety profile was consistent with previous reports. There was one treatment-related death. Nivolumab plus platinum-based chemotherapy was associated with prolonged survival in over one-third of chemonaïve patients with G3 GEP-NENs, with a manageable safety profile.",
Chronic lymphocytic leukaemia,,2017-01-19,No Abstract,
The TGFβ type I receptor kinase inhibitor vactosertib in combination with pomalidomide in relapsed/refractory multiple myeloma: a phase 1b trial,"Ehsan Malek, Priyanka S. Rana, Muthulekha Swamydas, Michael Daunov, Masaru Miyagi, Elena Murphy, James J. Ignatz-Hoover, Leland Metheny, Seong Jin Kim, James J. Driscoll",2024-08-27,"Functional blockade of the transforming growth factor-beta (TGFβ) signalling pathway improves the efficacy of cytotoxic and immunotherapies. Here, we conducted a phase 1b study (ClinicalTrials.gov., NCT03143985) to determine the primary endpoints of safety, tolerability, and maximal tolerated dose (200 mg twice daily) for the orally-available TGFβ type I receptor kinase inhibitor vactosertib in combination with pomalidomide in relapsed and/or refractory multiple myeloma (RRMM) patients who had received ≥2 lines of chemoimmunotherapy. Secondary endpoints demonstrated sustained clinical responses, favorable pharmacokinetic parameters and a 6-month progression-free survival of 82%. Vactosertib combined with pomalidomide was well-tolerated at all dose levels and displayed a manageable adverse event profile. Exploratory analysis indicated that vactosertib co-treatment with pomalidomide also reduced TGFβ levels in patient bone marrow as well as the level of CD8+ T-cells that expressed the immunoinhibitory marker PD-1. In vitro experiments indicated that vactosertib+pomalidomide co-treatment decreased the viability of MM cell lines and patient tumor cells, and increased CD8+ T-cell cytotoxic activity. Vactosertib is a safe therapeutic that demonstrates tumor-intrinsic activity and can overcome immunosuppressive challenges within the tumor microenvironment to reinvigorate T-cell fitness. Vactosertib offers promise to improve immunotherapeutic responses in heavily-pretreated MM patients refractory to conventional agents.",
A novel small molecule Enpp1 inhibitor improves tumor control following radiation therapy by targeting stromal Enpp1 expression,"Jason R Baird, Alejandro F Alice, Roland Saito, Qingqing Chai, Minhua Han, Cindy Ng, Stephanie Han, Beth Fernandez, Sarah Ledoux, Johannes Grosse, Alan J Korman, Megan Potuznik, Venkatesh Rajamanickam, Brady Bernard, Marka R Crittenden, Michael J Gough",2024-12-02,"The uniqueness in each person’s cancer cells and variation in immune infiltrates means that each tumor represents a unique problem, but therapeutic targets can be found among their shared features. Radiation therapy alters the interaction between the cancer cells and the stroma through release of innate adjuvants. The extranuclear DNA that can result from radiation damage of cells can result in production of the second messenger cyclic guanosine monophosphate–adenosine monophosphate (cGAMP) by cyclic GMP-AMP synthase (cGAS). In turn, cGAMP can activate the innate sensor stimulator of interferon genes (STING), resulting in innate immune activation. Ectonucleotide pyrophosphatase/phosphodiesterase 1 (Enpp1) is a phosphodiesterase that can be expressed by cancer cells that can degrade cGAMP, thus can decrease or block STING activation following radiation therapy, impairing the innate immunity that is critical to support adaptive immune control of tumors. We observed that many human and murine cancer cells lack Enpp1 expression, but that Enpp1 is expressed in cells of the tumor stroma where it limits tumor control by radiation therapy. We demonstrate in preclinical models the efficacy of a novel Enpp1 inhibitor and show that this inhibitor improves tumor control by radiation even where the cancer cells lack Enpp1. This mechanism requires STING and type I interferon (IFN) receptor expression by non-cancer cells and is dependent on CD8 T cells as a final effector mechanism of tumor control. This suggests that Enpp1 inhibition may be an effective partner for radiation therapy regardless of whether cancer cells express Enpp1. This broadens the potential patient base for whom Enpp1 inhibitors can be applied to improve innate immune responses following radiation therapy.",
KRAS G12C mutation in NSCLC in a small genetic center: insights into sotorasib therapy response potential,"Metin Eser, Gulam Hekimoglu, Murat Hakki Yarar, Sezin Canbek, Melike Ozcelik",2024-11-04,"Lung cancer remains a significant health challenge, characterized by aberrant tissue growth within the pulmonary system. Early carcinogenic events often involve genomic instability and the emergence of a mutator phenotype. In this study, we aimed to explore the mutator phenotype in 89 patients diagnosed with non-small-cell lung cancer (NSCLC). RNA isolation from formalin-fixed paraffin-embedded (FFPE) tissue samples was performed using the Promega ReliaPrep RNA Miniprep System, facilitating gene amplification relevant to cancer through the Archer® FusionPlexComprehensiveThyroid and Lung (CTL) kit. Next-generation sequencing (NGS) on the Illumina NextSeq platform enabled comprehensive analysis of target areas. Utilizing Archer Analysis software, secondary analyses involving data cleansing, alignment, and variant/fusion identification were executed against the human reference genome hg19 (GRCh37). Expression patterns were visualized using HeatMap graphics. Our findings revealed a notable presence of KRAS gene mutations in approximately 20% of NSCLC patients. Among these mutations, the G12C variant was predominant at 50%, followed by G12V and G12D variants at 11.2% each. Notably, patients harboring the G12C variant responded favorably to sotorasib medication. These results underscore the importance of mutational profiling and targeted therapeutic approaches in managing NSCLC, particularly highlighting the promising efficacy of sotorasib in G12C-mutated cases.","KRAS G12C mutation, Non-small-cell lung cancer, Sotorasib"
Radiomics analysis in differentiating osteosarcoma and chondrosarcoma based on T2-weighted imaging and contrast-enhanced T1-weighted imaging,"Zhi Gao, Zhongshang Dai, Zhengxiao Ouyang, Dianqing Li, Sihuai Tang, Penglin Li, Xudong Liu, Yongfang Jiang, Deye Song",2024-11-04,"This study was performed to investigate the diagnostic value of radiomics models constructed by fat suppressed T2-weighted imaging (T2WI-FS) and contrast-enhanced T1-weighted imaging (CET1) based on magnetic resonance imaging (MRI) for differentiation of osteosarcoma (OS) and chondrosarcoma (CS). In this retrospective cohort study, we included all inpatients with pathologically confirmed OS or CS from Second Xiangya Hospital of Central South University (Hunan, China) as of October 2020. Demographic and imaging variables were extracted from electronic medical records and compared between OS and CS group. Totals of 530 radiomics features were extracted from CET1 and T2WI-FS sequences based on MRI. The least absolute shrinkage and selection operator (LASSO) method was used for screening and dimensionality reduction of the radiomics model. Multivariate logistic regression analysis was performed to construct the radiomics model, and receiver operating characteristic curve (ROC) was generated to evaluate the diagnostic accuracy of the radiomics model. The training cohort and validation cohort included 87 and 29 patients, respectively. 8 CET1 features and 15 T2WI-FS features were screened based on the radiomics features. In the training group, the area under the receiver-operator characteristic curve (AUC) value for CET1 and T2WI-FS sequences in the radiomics model was 0.894 (95% CI 0.817–0.970) and 0.970 (95% CI 0.940–0.999), respectively. In the validation group, the AUC value for CET1 and T2WI-FS sequences in the radiomics model was 0.821 (95% CI 0.642–1.000) and 0.899 (95% CI 0.785–1.000), respectively. In this study, we developed a radiomics model based on T2WI-FS and CET1 sequences to differentiate between OS and CS. This model exhibits good performance and can help clinicians make decisions and optimize the use of healthcare resources.","Osteosarcoma, Chondrosarcoma, Radiomics, Magnetic resonance imaging, Differential diagnosis"
